### ISSUE TITLE
Payload not being processed correctly?

### ISSUE THREAD

**Issue by Thespis377** [adnanh/webhook#398]
I apologize in advance if this is the wrong place for this.  I've read and reread the documents several times and cannot figure out why my payload isn't being processed correctly.  I am using NetBox to trigger some code when certain things are created or updated.  I have verified 6 ways from Sunday that the hook is being triggered and data is being sent.

```Feb 17 11:12:48 redoak webhook: [webhook] 2020/02/17 17:12:48 [927a51] incoming HTTP request from 130.18.8.64:35484
Feb 17 11:12:48 redoak webhook: [webhook] 2020/02/17 17:12:48 [927a51] fixstack got matched
Feb 17 11:12:48 redoak webhook: [webhook] 2020/02/17 17:12:48 [927a51] fixstack hook triggered successfully
Feb 17 11:12:48 redoak webhook: [webhook] 2020/02/17 17:12:48 200 | 174.633µs | redoak.its.msstate.edu:9090 | POST /hooks/fixstack
Feb 17 11:12:48 redoak webhook: [webhook] 2020/02/17 17:12:48 [927a51] error extracting command arguments: couldn't retrieve argument for {Source:payload Name:data.master.name EnvName: Base64Decode:false}
Feb 17 11:12:48 redoak webhook: [webhook] 2020/02/17 17:12:48 [927a51] executing /opt/adm/bin/fixNetBoxStack.py (/opt/adm/bin/fixNetBoxStack.py) with arguments ["/opt/adm/bin/fixNetBoxStack.py" ""] and environment [] using /tmp/ as cwd
Feb 17 11:12:48 redoak webhook: [webhook] 2020/02/17 17:12:48 [927a51] command output: ['']
Feb 17 11:12:48 redoak webhook: There was an error while updating  in NetBox
Feb 17 11:12:48 redoak webhook: [webhook] 2020/02/17 17:12:48 [927a51] finished handling fixstack
```
```Host: redoak.its.msstate.edu:9090
Accept-Encoding: identity
Content-Type: JSON
Content-Length: 326


11:03:45.796280 IP (tos 0x0, ttl 64, id 12661, offset 0, flags [DF], proto TCP (6), length 40)
    130.18.8.11.9090 > 130.18.8.64.35464: Flags [.], cksum 0x148a (incorrect -> 0x2a00), seq 951890894, ack 1242139816, win 30, length 0
E..(1u@.@..........@#...8...J	..P.......
11:03:45.796294 IP (tos 0x0, ttl 64, id 27272, offset 0, flags [DF], proto TCP (6), length 366)
    130.18.8.64.35464 > 130.18.8.11.9090: Flags [P.], cksum 0x5bc1 (correct), seq 1242139816:1242140142, ack 951890894, win 229, length 326
E..nj.@.@......@......#.J	..8...P...[...{"event": "updated", "timestamp": "2020-02-17 11:03:45.766730", "model": "virtualchassis", "username": "gtg4", "request_id": "d16737c6-0be9-40b4-b42b-6d6e656d6345", "data": {"id": 14, "master": {"id": 2236, "url": "/api/dcim/devices/2236/", "name": "test.chassis1", "display_name": "test.chassis1"}, "domain": "", "tags": []}}
11:03:45.796301 IP (tos 0x0, ttl 64, id 12662, offset 0, flags [DF], proto TCP (6), length 40)
    130.18.8.11.9090 > 130.18.8.64.35464: Flags [.], cksum 0x148a (incorrect -> 0x28b9), seq 951890894, ack 1242140142, win 31, length 0
E..(1v@.@..........@#...8...J	..P.......
11:03:45.796964 IP (tos 0x0, ttl 64, id 12663, offset 0, flags [DF], proto TCP (6), length 156)
    130.18.8.11.9090 > 130.18.8.64.35464: Flags [P.], cksum 0x14fe (incorrect -> 0x3f5a), seq 951890894:951891010, ack 1242140142, win 31, length 116
E...1w@.@..u.......@#...8...J	..P.......HTTP/1.1 200 OK
```

If you look at the packet capture, the JSON is being sent, but the payload is being ignored.  I can't figure out what I'm doing wrong.  Especially after it worked for weeks and stopped working after a reboot of the server.  Here is the relevant config for webhook.

```  {
    "id": "fixstack",
    "execute-command":  "/opt/adm/bin/fixNetBoxStack.py",
    "command-working-directory": "/tmp/",
    "pass-arguments-to-command":
    [
      {
        "source": "payload",
        "name": "data.master.name"
      }
    ],
    "trigger-rule":
    {
      "match":
      {
        "type": "ip-whitelist",
        "ip-range": "130.18.8.0/24"
      }
    }
  },
```

Any help would be greatly appreciated.  Thank you.

**Comment by adnanh** [comment]
What version of webhook are you running, and could you add `"incoming-payload-content-type": "application/json"` to the hook definition?

**Comment by Thespis377** [comment]
Holy cow, that worked.  I'm running webhook version 2.6.9.  Thank you so much!  I had tried everything I could think of and none of it worked.

**Comment by adnanh** [comment]
Yes, the problem here is that the [IANA](http://www.iana.org/) has registered the official MIME Type for JSON as `application/json`, which in this case is not being sent like that by your client, thus the webhook doesn't register it as a JSON encoded payload, and simply skips it. We've merged the feature in development branch which warns you in such cases, and had you had it, you would probably figured it out sooner. :-)

2.7.0 will be out soon hopefully.
