### ISSUE TITLE
Too many open files

### ISSUE THREAD

**Issue by dyipon** [adnanh/webhook#414]
After a few hours of running I get "Too many open files" error, and webhook dies. 

OS: debian buster, Webhook installed from official apt sources

```ls -l /proc/11294/fd | wc -l```
result: 721 open socket:
_lrwx------ 1 root root 64 Apr 24 21:44 718 -> 'socket:[3390743]'
lrwx------ 1 root root 64 Apr 24 21:44 719 -> 'socket:[3390857]'_

my conf:
```
[
  {
    "id": "minio-webhook",
    "execute-command": "/root/webhook/rclone-sync.sh",
    "command-working-directory": "/root/webhook/",
    "pass-arguments-to-command":
    [
      {
            "source": "payload",
            "name": "Key"
      }
    ]
  }
]
````

Any ideas how to fix it?

thanks

**Comment by moorereason** [comment]
Can you give us a sampling of what lsof shows (`lsof -p 11294`)?  Are these all IP sockets or regular file descriptors?  Need more info to be able to help.

**Comment by dyipon** [comment]
```
 lsof -p 35281
COMMAND   PID USER   FD      TYPE             DEVICE SIZE/OFF    NODE NAME
webhook 35281 root  cwd       DIR              202,1     4096       2 /
webhook 35281 root  rtd       DIR              202,1     4096       2 /
webhook 35281 root  txt       REG              202,1  7410896  159883 /usr/bin/webhook
webhook 35281 root  mem       REG              202,1  1824496  131762 /usr/lib/x86_64-linux-gnu/libc-2.28.so
webhook 35281 root  mem       REG              202,1   146968  131780 /usr/lib/x86_64-linux-gnu/libpthread-2.28.so
webhook 35281 root  mem       REG              202,1   165632  131099 /usr/lib/x86_64-linux-gnu/ld-2.28.so
webhook 35281 root    0r      CHR                1,3      0t0    1028 /dev/null
webhook 35281 root    1u     unix 0x00000000fb90316e      0t0 3399143 type=STREAM
webhook 35281 root    2u     unix 0x00000000fb90316e      0t0 3399143 type=STREAM
webhook 35281 root    3u     IPv6            3398231      0t0     TCP *:999 (LISTEN)
webhook 35281 root    4u  a_inode               0,13        0    9261 [eventpoll]
webhook 35281 root    5u     IPv6            3406459      0t0     TCP localhost:999->localhost:34236 (ESTABLISHED)
webhook 35281 root    6u     IPv6            3402369      0t0     TCP localhost:999->localhost:34382 (ESTABLISHED)
webhook 35281 root    7u     IPv6            3406463      0t0     TCP localhost:999->localhost:34240 (ESTABLISHED)
webhook 35281 root    8u     IPv6            3406504      0t0     TCP localhost:999->localhost:34284 (ESTABLISHED)
webhook 35281 root    9u     IPv6            3410952      0t0     TCP localhost:999->localhost:34286 (ESTABLISHED)
webhook 35281 root   10u     IPv6            3408904      0t0     TCP localhost:999->localhost:34242 (ESTABLISHED)
webhook 35281 root   11u     IPv6            3408908      0t0     TCP localhost:999->localhost:34244 (ESTABLISHED)
webhook 35281 root   12u     IPv6            3408946      0t0     TCP localhost:999->localhost:34298 (ESTABLISHED)
webhook 35281 root   13u     IPv6            3408912      0t0     TCP localhost:999->localhost:34246 (ESTABLISHED)
webhook 35281 root   14u     IPv6            3408917      0t0     TCP localhost:999->localhost:34248 (ESTABLISHED)
webhook 35281 root   15u     IPv6            3409002      0t0     TCP localhost:999->localhost:34386 (ESTABLISHED)
webhook 35281 root   16u     IPv6            3409010      0t0     TCP localhost:999->localhost:34388 (ESTABLISHED)
webhook 35281 root   17u     IPv6            3408950      0t0     TCP localhost:999->localhost:34304 (ESTABLISHED)
webhook 35281 root   18u     IPv6            3408959      0t0     TCP localhost:999->localhost:34306 (ESTABLISHED)
webhook 35281 root   19u     IPv6            3406599      0t0     TCP localhost:999->localhost:34390 (ESTABLISHED)
webhook 35281 root   20u     IPv6            3405407      0t0     TCP localhost:999->localhost:34316 (ESTABLISHED)
webhook 35281 root   22u     IPv6            3406601      0t0     TCP localhost:999->localhost:34392 (ESTABLISHED)
webhook 35281 root   23u     IPv6            3408055      0t0     TCP localhost:999->localhost:34384 (ESTABLISHED)
webhook 35281 root   24u     IPv6            3408074      0t0     TCP localhost:999->localhost:34400 (ESTABLISHED)
webhook 35281 root   27u     IPv6            3405500      0t0     TCP localhost:999->localhost:34420 (ESTABLISHED)
webhook 35281 root   29u     IPv6            3411092      0t0     TCP localhost:999->localhost:34422 (ESTABLISHED)
webhook 35281 root   32u     IPv6            3411096      0t0     TCP localhost:999->localhost:34424 (ESTABLISHED)
webhook 35281 root   34u     IPv6            3407317      0t0     TCP localhost:999->localhost:34426 (ESTABLISHED)
webhook 35281 root   36u     IPv6            3409055      0t0     TCP localhost:999->localhost:34432 (ESTABLISHED)
webhook 35281 root   37r     FIFO               0,12      0t0 3411098 pipe
webhook 35281 root   38u     IPv6            3411108      0t0     TCP localhost:999->localhost:34442 (ESTABLISHED)
webhook 35281 root   44r     FIFO               0,12      0t0 3409057 pipe
webhook 35281 root   47r     FIFO               0,12      0t0 3410144 pipe
```

**Comment by moorereason** [comment]
That's interesting.  What are the client processes that are connecting to webhook?  Is it minio? I don't understand why the TCP connection is not being closed.

Can you do a packet capture to see what's happening?

**Comment by dyipon** [comment]
its a "normal" dump (with a simple curl):
```
09:49:15.147770 IP 127.0.0.1.57450 > 127.0.0.1.999: Flags [S], seq 420993661, win 65495, options [mss 65495,sackOK,TS val 2107042053 ecr 0,nop,wscale 7], length 0
E..<.k@.@.yN.........j.....}.........0.........
}...........
09:49:15.147797 IP 127.0.0.1.999 > 127.0.0.1.57450: Flags [S.], seq 656791856, ack 420993662, win 65483, options [mss 65495,sackOK,TS val 2107042053 ecr 2107042053,nop,wscale 7], length 0
E..<..@.@.<............j'%.0...~.....0.........
}...}.......
09:49:15.147815 IP 127.0.0.1.57450 > 127.0.0.1.999: Flags [.], ack 1, win 512, options [nop,nop,TS val 2107042053 ecr 2107042053], length 0
E..4.l@.@.yU.........j.....~'%.1.....(.....
}...}...
09:49:15.147888 IP 127.0.0.1.57450 > 127.0.0.1.999: Flags [P.], seq 1:89, ack 1, win 512, options [nop,nop,TS val 2107042053 ecr 2107042053], length 88
E....m@.@.x..........j.....~'%.1...........
}...}...GET /hooks/minio HTTP/1.1
Host: 127.0.0.1:999
User-Agent: curl/7.64.0
Accept: */*


09:49:15.147899 IP 127.0.0.1.999 > 127.0.0.1.57450: Flags [.], ack 89, win 511, options [nop,nop,TS val 2107042053 ecr 2107042053], length 0
E..4.*@.@..............j'%.1.........(.....
}...}...
09:49:15.148325 IP 127.0.0.1.999 > 127.0.0.1.57450: Flags [P.], seq 1:140, ack 89, win 512, options [nop,nop,TS val 2107042054 ecr 2107042053], length 139
E....+@.@..............j'%.1...............
}...}...HTTP/1.1 404 Not Found
Date: Sat, 25 Apr 2020 07:49:15 GMT
Content-Length: 15
Content-Type: text/plain; charset=utf-8

Hook not found.
09:49:15.148349 IP 127.0.0.1.57450 > 127.0.0.1.999: Flags [.], ack 140, win 511, options [nop,nop,TS val 2107042054 ecr 2107042054], length 0
E..4.n@.@.yS.........j......'%.......(.....
}...}...
09:49:15.148446 IP 127.0.0.1.57450 > 127.0.0.1.999: Flags [F.], seq 89, ack 140, win 512, options [nop,nop,TS val 2107042054 ecr 2107042054], length 0
E..4.o@.@.yR.........j......'%.......(.....
}...}...
09:49:15.148698 IP 127.0.0.1.999 > 127.0.0.1.57450: Flags [F.], seq 140, ack 90, win 512, options [nop,nop,TS val 2107042054 ecr 2107042054], length 0
E..4.,@.@..............j'%...........(.....
}...}...
09:49:15.148758 IP 127.0.0.1.57450 > 127.0.0.1.999: Flags [.], ack 141, win 512, options [nop,nop,TS val 2107042054 ecr 2107042054], length 0
E..4.p@.@.yQ.........j......'%.......(.....
}...}...
```

**Comment by dyipon** [comment]
and thats with minio (open source s3 server):
```
"........POST /hooks/minio-webhook HTTP/1.1
Host: localhost:999
User-Agent: Go-http-client/1.1
Content-Length: 1117
Content-Type: application/json

{"EventName":"s3:ObjectCreated:Put..."
```

but it seems minio does not close the connection, it tries to keep alive on every 15 seconds.
```
09:50:36.122634 IP6 ::1.40486 > ::1.999: Flags [.], ack 76, win 512, options [nop,nop,TS val 98102512 ecr 98102511], length 0
`.... .@.................................&...6....@(.....(.....
........

09:50:51.197127 IP6 ::1.40484 > ::1.999: Flags [.], ack 76, win 512, options [nop,nop,TS val 98117586 ecr 98102509], length 0
`.... .@.................................$......5........(.....
..'.....
09:50:51.197128 IP6 ::1.40486 > ::1.999: Flags [.], ack 76, win 512, options [nop,nop,TS val 98117586 ecr 98102511], length 0
`.... .@.................................&...6....@(.....(.....
..'.....
09:50:51.197138 IP6 ::1.999 > ::1.40484: Flags [.], ack 134, win 512, options [nop,nop,TS val 98117586 ecr 98102509], length 0
`.... .@...................................$5............(.....
..'.....

09:51:06.301121 IP6 ::1.40484 > ::1.999: Flags [.], ack 76, win 512, options [nop,nop,TS val 98132690 ecr 98117586], length 0
`.... .@.................................$......5........(.....
..b...'.
09:51:06.301125 IP6 ::1.40486 > ::1.999: Flags [.], ack 76, win 512, options [nop,nop,TS val 98132690 ecr 98117586], length 0
`.... .@.................................&...6....@(.....(.....
..b...'.
09:51:06.301134 IP6 ::1.999 > ::1.40484: Flags [.], ack 134, win 512, options [nop,nop,TS val 98132690 ecr 98102509], length 0
`.... .@...................................$5............(.....
..b.....

09:51:21.405135 IP6 ::1.40486 > ::1.999: Flags [.], ack 76, win 512, options [nop,nop,TS val 98147794 ecr 98132690], length 0
`.... .@.................................&...6....@(.....(.....
......b.
09:51:21.405147 IP6 ::1.999 > ::1.40486: Flags [.], ack 1263, win 512, options [nop,nop,TS val 98147794 ecr 98102512], length 0
`.... .@...................................&..@(.6.......(.....
........
09:51:21.405166 IP6 ::1.40484 > ::1.999: Flags [.], ack 76, win 512, options [nop,nop,TS val 98147794 ecr 98132690], length 0
`.... .@.................................$......5........(.....
......b.
09:51:21.405178 IP6 ::1.999 > ::1.40484: Flags [.], ack 134, win 512, options [nop,nop,TS val 98147794 ecr 98102509], length 0
`.... .@...................................$5............(.....
........
```

**Comment by dyipon** [comment]
I found something. Only those connections keeped alive which occured error: "error extracting command arguments: couldn't retrieve argument for {Source:payload Name:Key EnvName: Base64Decode:false}"
 I don't know if its minio or webhook side :/

**Comment by adnanh** [comment]
I'll check it out tomorrow hopefully, as I am at the moment not anywhere near any computer :-(

**Comment by adnanh** [comment]
Btw, could you try upgrading to latest version, I remember fixing a descriptor leak in some version :/

**Comment by dyipon** [comment]
no worries, systemctl restart webhook on failure.
I thought I installed the latest version, but debian apt package version is 2.6.9-1.  Now I leeched the latest the binary, but connections still kept alive if minio gives incorrect header:
"error parsing body payload due to unsupported content type header:"
"error extracting command arguments: couldn't retrieve argument for {Source:payload Name:Key EnvName: Base64Decode:false}"

**Comment by moorereason** [comment]
What version of minio are you running?  I'm not much of a betting man, but I'd put money on it being [this issue](https://github.com/minio/minio/pull/8847), which as fixed in RELEASE.2020-01-25T02-50-51Z.

**Comment by dyipon** [comment]
well, im using the latest minio. but nevermind, i opened a ticket already there.

**Comment by moorereason** [comment]
That's why I'm not a betting man.  :smile:

Sharing what I've found so far.

The extra request you're seeing (as mentioned in your minio ticket) is probably from the minio webhook calling [`IsActive()`](https://github.com/minio/minio/blob/4843affd0eab28e14e89de3f4c9a040d3b2659ca/pkg/event/target/webhook.go#L164) before sending each webhook.  Don't know why that's necessary.

It looks like the main minio http transport has [a max limit of 16 idle connections per host](https://github.com/minio/minio/blob/4843affd0eab28e14e89de3f4c9a040d3b2659ca/cmd/utils.go#L502).  The [`IsActive` check looks to be using a different transport](https://github.com/minio/minio/blob/4843affd0eab28e14e89de3f4c9a040d3b2659ca/pkg/event/target/webhook.go#L97-L101) that [don't have a max idle setting](https://github.com/minio/minio/blob/4843affd0eab28e14e89de3f4c9a040d3b2659ca/pkg/net/url.go#L90-L101), so they never get cleared.  What doesn't make sense to me is why the idle/keepalive connections are not being reused so that the active connection count keeps growing.  It feels like there has to be a bug in minio or Go here.

From webhook's vantage point, this is essentially a denial of service attack.  Do we need to add a config option to limit the max connections per host?  If we return a non-2XX response upon reaching max connections, it may cause minio to [close all idle connections](https://github.com/minio/minio/blob/4843affd0eab28e14e89de3f4c9a040d3b2659ca/pkg/event/target/webhook.go#L155) and try again later.

**Comment by adnanh** [comment]
I'm also wondering if we need http keepalive support in webhook at all, due to the nature of our requests that should be rather short lived, and not that frequent :/

**Comment by dyipon** [comment]
well, i think keep-alive is not essential for a 'simple' webhook service, because these requests are not speed-relevant (or it is, +5msec for an TCP connection opening is not a big deal).
 
It would superb if we can switch keep-alive settings in config. Thanks a lot.

**Comment by moorereason** [comment]
BTW, the Go docs for [`http.Server.SetKeepAlivesEnabled`](https://golang.org/pkg/net/http/#Server.SetKeepAlivesEnabled) discourages disabling keep-alives:

> Only very resource-constrained environments or servers in the process of shutting down should disable them.

I still believe the underlying issue is a bug upstream in minio/Go.

**Comment by adnanh** [comment]
Looks like they're rolling out the fix upstream https://github.com/minio/minio/issues/9460#issuecomment-619766606

:-)

**Comment by moorereason** [comment]
I was curious how one might work around this ulimit issue if you happened to be hosting a super-busy webhook instance.  🚀 

I found [this recommendation](https://docs.mongodb.com/manual/reference/ulimit/#linux-distributions-using-systemd) from MongoDB on updating the webhook service unit file in systemd:

```ini
[Service]
# (open files)
LimitNOFILE=64000
```

**Comment by dyipon** [comment]
Well, generally LimitNOFILE is ideal for any 'Too many open files' situation, but not for us :/ 
In a 8 hour shift we usually upload 30k images (which means 2x30k socket opening), so we reach the 64k limit in a few hours.  So I chose _RuntimeMaxSec_ in the service file.

```
[Service]
# auto restart on 30th minute
RuntimeMaxSec=1800
```

Usually webhook restart in a few msec, so it seems a good solution.

Anyway is there any ETA for [existence check](https://github.com/adnanh/webhook/projects/1#card-14824353) ? 
minio's isActive() is crazy, and making noisy logs:
Apr 27 20:59:28 minio webhook[3347]: [webhook] 2020/04/27 20:59:28 [4e3ea9] error parsing body payload due to unsupported content type header:
Apr 27 20:59:28 minio webhook[3347]: [webhook] 2020/04/27 20:59:28 [4e3ea9] minio-webhook hook triggered successfully

**Comment by dyipon** [comment]
latest minio solved this 'issue' :) thanks for your help guys

**Comment by adnanh** [comment]
Awesome, thank you! Regarding the existence check, we'll be rolling out a new feature that can help with that, keep an eye on #356

**Comment by adnanh** [comment]
@jrhbcn are you using minio as well?

**Comment by jrhbcn** [comment]
No,  I am using it locally (same machine, well LXC container) so I can execute scripts with [argus](https://github.com/release-argus/Argus).

**Comment by jrhbcn** [comment]
Hi, I am still hot by this bug every 5-6 days of using webhook. Is there anything I can do to help track it down?

**Comment by adnanh** [comment]
Hmm, can you check if the script that webhook is executing is not leaking file descriptors by any chance?

**Comment by jrhbcn** [comment]
> Hmm, can you check if the script that webhook is executing is not leaking file descriptors by any chance?

Thanks for looking into this. I only use a couple of hooks with two very similar bash scripts. The scripts check software versions using different techniques (curl, ssh or docker) depending on the command parameter. I don't think they leak any file as i can run the commands separately and they seem to end fine. One of the script looks like this for instance:

```
#!/bin/bash

case $1 in
  adguard)
    VERSION=$(ssh root@192.168.10.8 "/opt/AdGuardHome/AdGuardHome --version" | awk '{print $4}' | cut -c 2-)
    ;;
  argus)
    VERSION=$(curl --no-keepalive -s http://192.168.10.10:9031/api/v1/version | jq -r '.version')
    ;;
  calibre)
    VERSION=$(docker inspect --format='{{json .Config.Labels}}' calibre | jq -r '."org.opencontainers.image.version"' | grep -Po "v?\K([0-9.]+)" | head -1)
    ;;
  librespeed)
    VERSION=$(docker exec librespeed cat speedtest.js | grep "LibreSpeed by" | grep -Po "v?\K([0-9.]+) " | sed 's/.$//')
    ;;
esac

echo {\"name\":\"$1\"\,\"version\":\"$VERSION\"}
```

**Comment by moorereason** [comment]
@jrhbcn, this issue has been closed for two years.  Please open a new issue.
